,title,date,text
323,The IDF spokesman announces: Continue to shoot Palestinian children,"['February 12, 2020']","Christmas is a story of empire, injustice and the vulnerability of ordinary people caught in its path. In Gaza, the sky often offers a kind of beauty that feels almost unreal when set against the landscape beneath it. Strange though it may now seem, Phillips in that era epitomised the anguished North London liberal, existentially unsure about whether to obey the dictates of her heart or her head. Quds News Network (QNN) is the largest independent and comprehensive Palestinian youth electronic news network."
324,Where have the Arab masses gone?,"['February 10, 2020']","Christmas is a story of empire, injustice and the vulnerability of ordinary people caught in its path. In Gaza, the sky often offers a kind of beauty that feels almost unreal when set against the landscape beneath it. Strange though it may now seem, Phillips in that era epitomised the anguished North London liberal, existentially unsure about whether to obey the dictates of her heart or her head. Quds News Network (QNN) is the largest independent and comprehensive Palestinian youth electronic news network."
325,"75 years after the liberation of Auschwitz, Gaza is my prison","['February 8, 2020']","Christmas is a story of empire, injustice and the vulnerability of ordinary people caught in its path. In Gaza, the sky often offers a kind of beauty that feels almost unreal when set against the landscape beneath it. Strange though it may now seem, Phillips in that era epitomised the anguished North London liberal, existentially unsure about whether to obey the dictates of her heart or her head. Quds News Network (QNN) is the largest independent and comprehensive Palestinian youth electronic news network."
326,We stopped security coordination. We will stop security coordination,"['February 8, 2020']","Christmas is a story of empire, injustice and the vulnerability of ordinary people caught in its path. In Gaza, the sky often offers a kind of beauty that feels almost unreal when set against the landscape beneath it. Strange though it may now seem, Phillips in that era epitomised the anguished North London liberal, existentially unsure about whether to obey the dictates of her heart or her head. Quds News Network (QNN) is the largest independent and comprehensive Palestinian youth electronic news network."
327,Why have Arab rulers accepted the Trump deal?,"['February 8, 2020']","Christmas is a story of empire, injustice and the vulnerability of ordinary people caught in its path. In Gaza, the sky often offers a kind of beauty that feels almost unreal when set against the landscape beneath it. Strange though it may now seem, Phillips in that era epitomised the anguished North London liberal, existentially unsure about whether to obey the dictates of her heart or her head. Quds News Network (QNN) is the largest independent and comprehensive Palestinian youth electronic news network."
328,On Jared Kushner's 25 books of undiluted Zionist propaganda,"['February 4, 2020']","Christmas is a story of empire, injustice and the vulnerability of ordinary people caught in its path. In Gaza, the sky often offers a kind of beauty that feels almost unreal when set against the landscape beneath it. Strange though it may now seem, Phillips in that era epitomised the anguished North London liberal, existentially unsure about whether to obey the dictates of her heart or her head. Quds News Network (QNN) is the largest independent and comprehensive Palestinian youth electronic news network."
329,I have just read 25 books and am here to perform your open-heart surgery,"['February 4, 2020']","Christmas is a story of empire, injustice and the vulnerability of ordinary people caught in its path. In Gaza, the sky often offers a kind of beauty that feels almost unreal when set against the landscape beneath it. Strange though it may now seem, Phillips in that era epitomised the anguished North London liberal, existentially unsure about whether to obey the dictates of her heart or her head. Quds News Network (QNN) is the largest independent and comprehensive Palestinian youth electronic news network."
330,Labour’s fabricated anti-Semitism crisis is being replicated in America,"['February 2, 2020']","Christmas is a story of empire, injustice and the vulnerability of ordinary people caught in its path. In Gaza, the sky often offers a kind of beauty that feels almost unreal when set against the landscape beneath it. Strange though it may now seem, Phillips in that era epitomised the anguished North London liberal, existentially unsure about whether to obey the dictates of her heart or her head. Quds News Network (QNN) is the largest independent and comprehensive Palestinian youth electronic news network."
331,Palestinians have indeed 'missed an opportunity' - to surrender to Zionism,"['February 1, 2020']","Christmas is a story of empire, injustice and the vulnerability of ordinary people caught in its path. In Gaza, the sky often offers a kind of beauty that feels almost unreal when set against the landscape beneath it. Strange though it may now seem, Phillips in that era epitomised the anguished North London liberal, existentially unsure about whether to obey the dictates of her heart or her head. Quds News Network (QNN) is the largest independent and comprehensive Palestinian youth electronic news network."
332,The apartheid deal of the century,"['February 1, 2020']","Christmas is a story of empire, injustice and the vulnerability of ordinary people caught in its path. In Gaza, the sky often offers a kind of beauty that feels almost unreal when set against the landscape beneath it. Strange though it may now seem, Phillips in that era epitomised the anguished North London liberal, existentially unsure about whether to obey the dictates of her heart or her head. Quds News Network (QNN) is the largest independent and comprehensive Palestinian youth electronic news network."
333,Shot by Israel for planting trees,"['February 1, 2020']","Christmas is a story of empire, injustice and the vulnerability of ordinary people caught in its path. In Gaza, the sky often offers a kind of beauty that feels almost unreal when set against the landscape beneath it. Strange though it may now seem, Phillips in that era epitomised the anguished North London liberal, existentially unsure about whether to obey the dictates of her heart or her head. Quds News Network (QNN) is the largest independent and comprehensive Palestinian youth electronic news network."
334,Palestinians have only one option left: Stay and fight,"['January 29, 2020']","Christmas is a story of empire, injustice and the vulnerability of ordinary people caught in its path. In Gaza, the sky often offers a kind of beauty that feels almost unreal when set against the landscape beneath it. Strange though it may now seem, Phillips in that era epitomised the anguished North London liberal, existentially unsure about whether to obey the dictates of her heart or her head. Quds News Network (QNN) is the largest independent and comprehensive Palestinian youth electronic news network."
335,"Trump's 'peace plan': The farce, the fraud and the fury","['January 29, 2020']","Christmas is a story of empire, injustice and the vulnerability of ordinary people caught in its path. In Gaza, the sky often offers a kind of beauty that feels almost unreal when set against the landscape beneath it. Strange though it may now seem, Phillips in that era epitomised the anguished North London liberal, existentially unsure about whether to obey the dictates of her heart or her head. Quds News Network (QNN) is the largest independent and comprehensive Palestinian youth electronic news network."
336,"Trump's Mideast Plan Is a Recipe for War, Not Peace","['January 28, 2020']","Christmas is a story of empire, injustice and the vulnerability of ordinary people caught in its path. In Gaza, the sky often offers a kind of beauty that feels almost unreal when set against the landscape beneath it. Strange though it may now seem, Phillips in that era epitomised the anguished North London liberal, existentially unsure about whether to obey the dictates of her heart or her head. Quds News Network (QNN) is the largest independent and comprehensive Palestinian youth electronic news network."
337,Why Israel Cares to Export Gas to Arab Countries?,"['January 28, 2020']","Christmas is a story of empire, injustice and the vulnerability of ordinary people caught in its path. In Gaza, the sky often offers a kind of beauty that feels almost unreal when set against the landscape beneath it. Strange though it may now seem, Phillips in that era epitomised the anguished North London liberal, existentially unsure about whether to obey the dictates of her heart or her head. Quds News Network (QNN) is the largest independent and comprehensive Palestinian youth electronic news network."
338,Is Mohammad Bin Salman a Zionist?,"['January 28, 2020']","Christmas is a story of empire, injustice and the vulnerability of ordinary people caught in its path. In Gaza, the sky often offers a kind of beauty that feels almost unreal when set against the landscape beneath it. Strange though it may now seem, Phillips in that era epitomised the anguished North London liberal, existentially unsure about whether to obey the dictates of her heart or her head. Quds News Network (QNN) is the largest independent and comprehensive Palestinian youth electronic news network."
339,"Trump’s next meeting with Netanyahu is for personal benefit, not national interests","['January 28, 2020']","Christmas is a story of empire, injustice and the vulnerability of ordinary people caught in its path. In Gaza, the sky often offers a kind of beauty that feels almost unreal when set against the landscape beneath it. Strange though it may now seem, Phillips in that era epitomised the anguished North London liberal, existentially unsure about whether to obey the dictates of her heart or her head. Quds News Network (QNN) is the largest independent and comprehensive Palestinian youth electronic news network."
340,"ICC delays, Israeli belligerence and PA complacency","['January 24, 2020']","Christmas is a story of empire, injustice and the vulnerability of ordinary people caught in its path. In Gaza, the sky often offers a kind of beauty that feels almost unreal when set against the landscape beneath it. Strange though it may now seem, Phillips in that era epitomised the anguished North London liberal, existentially unsure about whether to obey the dictates of her heart or her head. Quds News Network (QNN) is the largest independent and comprehensive Palestinian youth electronic news network."
341,The EU has a duty to recognise the state of Palestine,"['January 21, 2020']","Christmas is a story of empire, injustice and the vulnerability of ordinary people caught in its path. In Gaza, the sky often offers a kind of beauty that feels almost unreal when set against the landscape beneath it. Strange though it may now seem, Phillips in that era epitomised the anguished North London liberal, existentially unsure about whether to obey the dictates of her heart or her head. Quds News Network (QNN) is the largest independent and comprehensive Palestinian youth electronic news network."
342,In the name of ‘Israel’s security’: retreating US gives Israel billions more in military funding,"['January 21, 2020']","Christmas is a story of empire, injustice and the vulnerability of ordinary people caught in its path. In Gaza, the sky often offers a kind of beauty that feels almost unreal when set against the landscape beneath it. Strange though it may now seem, Phillips in that era epitomised the anguished North London liberal, existentially unsure about whether to obey the dictates of her heart or her head. Quds News Network (QNN) is the largest independent and comprehensive Palestinian youth electronic news network."
343,Israel’s crime of stealing Palestinian organs continues,"['January 19, 2020']","Christmas is a story of empire, injustice and the vulnerability of ordinary people caught in its path. In Gaza, the sky often offers a kind of beauty that feels almost unreal when set against the landscape beneath it. Strange though it may now seem, Phillips in that era epitomised the anguished North London liberal, existentially unsure about whether to obey the dictates of her heart or her head. Quds News Network (QNN) is the largest independent and comprehensive Palestinian youth electronic news network."
344,How anti-Muslim war makes US democracy impossible,"['January 15, 2020']","Christmas is a story of empire, injustice and the vulnerability of ordinary people caught in its path. In Gaza, the sky often offers a kind of beauty that feels almost unreal when set against the landscape beneath it. Strange though it may now seem, Phillips in that era epitomised the anguished North London liberal, existentially unsure about whether to obey the dictates of her heart or her head. Quds News Network (QNN) is the largest independent and comprehensive Palestinian youth electronic news network."
345,Israel and El Salvador: Love in a time of genocide,"['January 15, 2020']","Christmas is a story of empire, injustice and the vulnerability of ordinary people caught in its path. In Gaza, the sky often offers a kind of beauty that feels almost unreal when set against the landscape beneath it. Strange though it may now seem, Phillips in that era epitomised the anguished North London liberal, existentially unsure about whether to obey the dictates of her heart or her head. Quds News Network (QNN) is the largest independent and comprehensive Palestinian youth electronic news network."
346,How should we interpret Hamas’ attendance at the funeral of Iran’s general?,"['January 12, 2020']","Christmas is a story of empire, injustice and the vulnerability of ordinary people caught in its path. In Gaza, the sky often offers a kind of beauty that feels almost unreal when set against the landscape beneath it. Strange though it may now seem, Phillips in that era epitomised the anguished North London liberal, existentially unsure about whether to obey the dictates of her heart or her head. Quds News Network (QNN) is the largest independent and comprehensive Palestinian youth electronic news network."
347,Israel and the PA are seeking to prevent Hamas from running in the elections,"['January 11, 2020']","Christmas is a story of empire, injustice and the vulnerability of ordinary people caught in its path. In Gaza, the sky often offers a kind of beauty that feels almost unreal when set against the landscape beneath it. Strange though it may now seem, Phillips in that era epitomised the anguished North London liberal, existentially unsure about whether to obey the dictates of her heart or her head. Quds News Network (QNN) is the largest independent and comprehensive Palestinian youth electronic news network."
348,More war crimes are Israel’s plan for the immediate future,"['January 11, 2020']","Christmas is a story of empire, injustice and the vulnerability of ordinary people caught in its path. In Gaza, the sky often offers a kind of beauty that feels almost unreal when set against the landscape beneath it. Strange though it may now seem, Phillips in that era epitomised the anguished North London liberal, existentially unsure about whether to obey the dictates of her heart or her head. Quds News Network (QNN) is the largest independent and comprehensive Palestinian youth electronic news network."
349,Will the last US soldier out of the Gulf please turn off the lights?,"['January 10, 2020']","Christmas is a story of empire, injustice and the vulnerability of ordinary people caught in its path. In Gaza, the sky often offers a kind of beauty that feels almost unreal when set against the landscape beneath it. Strange though it may now seem, Phillips in that era epitomised the anguished North London liberal, existentially unsure about whether to obey the dictates of her heart or her head. Quds News Network (QNN) is the largest independent and comprehensive Palestinian youth electronic news network."
350,Zionism and ‘Anti-Semitism’: A Chronicle of a Smear Foretold,"['January 10, 2020']","Christmas is a story of empire, injustice and the vulnerability of ordinary people caught in its path. In Gaza, the sky often offers a kind of beauty that feels almost unreal when set against the landscape beneath it. Strange though it may now seem, Phillips in that era epitomised the anguished North London liberal, existentially unsure about whether to obey the dictates of her heart or her head. Quds News Network (QNN) is the largest independent and comprehensive Palestinian youth electronic news network."
351,"Israel's Fauda: Immoral, exploitative drama turns Palestinian suffering into entertainment","['January 8, 2020']","Christmas is a story of empire, injustice and the vulnerability of ordinary people caught in its path. In Gaza, the sky often offers a kind of beauty that feels almost unreal when set against the landscape beneath it. Strange though it may now seem, Phillips in that era epitomised the anguished North London liberal, existentially unsure about whether to obey the dictates of her heart or her head. Quds News Network (QNN) is the largest independent and comprehensive Palestinian youth electronic news network."
352,Trump has no idea what he has done by killing Soleimani,"['January 7, 2020']","Christmas is a story of empire, injustice and the vulnerability of ordinary people caught in its path. In Gaza, the sky often offers a kind of beauty that feels almost unreal when set against the landscape beneath it. Strange though it may now seem, Phillips in that era epitomised the anguished North London liberal, existentially unsure about whether to obey the dictates of her heart or her head. Quds News Network (QNN) is the largest independent and comprehensive Palestinian youth electronic news network."
353,The antisemitic deal of the century,"['January 7, 2020']","Christmas is a story of empire, injustice and the vulnerability of ordinary people caught in its path. In Gaza, the sky often offers a kind of beauty that feels almost unreal when set against the landscape beneath it. Strange though it may now seem, Phillips in that era epitomised the anguished North London liberal, existentially unsure about whether to obey the dictates of her heart or her head. Quds News Network (QNN) is the largest independent and comprehensive Palestinian youth electronic news network."
354,Justice at Last? ‘Panic’ in Israel as the ICC Takes ‘Momentous Step’ in the Right Direction,"['January 7, 2020']","Christmas is a story of empire, injustice and the vulnerability of ordinary people caught in its path. In Gaza, the sky often offers a kind of beauty that feels almost unreal when set against the landscape beneath it. Strange though it may now seem, Phillips in that era epitomised the anguished North London liberal, existentially unsure about whether to obey the dictates of her heart or her head. Quds News Network (QNN) is the largest independent and comprehensive Palestinian youth electronic news network."
355,The ‘Great Game’ is afoot: Killing Soleimani reflects US desperation in the Middle East,"['January 6, 2020']","Christmas is a story of empire, injustice and the vulnerability of ordinary people caught in its path. In Gaza, the sky often offers a kind of beauty that feels almost unreal when set against the landscape beneath it. Strange though it may now seem, Phillips in that era epitomised the anguished North London liberal, existentially unsure about whether to obey the dictates of her heart or her head. Quds News Network (QNN) is the largest independent and comprehensive Palestinian youth electronic news network."
356,"The assassination of Soleimani and al-Muhandis, the most likely scenario","['January 5, 2020']","Christmas is a story of empire, injustice and the vulnerability of ordinary people caught in its path. In Gaza, the sky often offers a kind of beauty that feels almost unreal when set against the landscape beneath it. Strange though it may now seem, Phillips in that era epitomised the anguished North London liberal, existentially unsure about whether to obey the dictates of her heart or her head. Quds News Network (QNN) is the largest independent and comprehensive Palestinian youth electronic news network."
357,Trump’s reckless gamble with world peace,"['January 4, 2020']","Christmas is a story of empire, injustice and the vulnerability of ordinary people caught in its path. In Gaza, the sky often offers a kind of beauty that feels almost unreal when set against the landscape beneath it. Strange though it may now seem, Phillips in that era epitomised the anguished North London liberal, existentially unsure about whether to obey the dictates of her heart or her head. Quds News Network (QNN) is the largest independent and comprehensive Palestinian youth electronic news network."
358,Trump thwarts rebuilding of Gaza towers,"['January 2, 2020']","Christmas is a story of empire, injustice and the vulnerability of ordinary people caught in its path. In Gaza, the sky often offers a kind of beauty that feels almost unreal when set against the landscape beneath it. Strange though it may now seem, Phillips in that era epitomised the anguished North London liberal, existentially unsure about whether to obey the dictates of her heart or her head. Quds News Network (QNN) is the largest independent and comprehensive Palestinian youth electronic news network."
359,Understanding Canada’s ‘orphan vote’ at the United Nations,[],"Christmas is a story of empire, injustice and the vulnerability of ordinary people caught in its path. In Gaza, the sky often offers a kind of beauty that feels almost unreal when set against the landscape beneath it. Strange though it may now seem, Phillips in that era epitomised the anguished North London liberal, existentially unsure about whether to obey the dictates of her heart or her head. Quds News Network (QNN) is the largest independent and comprehensive Palestinian youth electronic news network."
360,Jeremy Corbyn’s visit to Tunisia cemetery exemplifies defamation campaign against him,[],"Christmas is a story of empire, injustice and the vulnerability of ordinary people caught in its path. In Gaza, the sky often offers a kind of beauty that feels almost unreal when set against the landscape beneath it. Strange though it may now seem, Phillips in that era epitomised the anguished North London liberal, existentially unsure about whether to obey the dictates of her heart or her head. Quds News Network (QNN) is the largest independent and comprehensive Palestinian youth electronic news network."
361,Torture of Palestinian detainees prevails in Israeli jails,[],"Christmas is a story of empire, injustice and the vulnerability of ordinary people caught in its path. In Gaza, the sky often offers a kind of beauty that feels almost unreal when set against the landscape beneath it. Strange though it may now seem, Phillips in that era epitomised the anguished North London liberal, existentially unsure about whether to obey the dictates of her heart or her head. Quds News Network (QNN) is the largest independent and comprehensive Palestinian youth electronic news network."
362,A year in review: will 2020 be a game changer in Palestine?,[],"Christmas is a story of empire, injustice and the vulnerability of ordinary people caught in its path. In Gaza, the sky often offers a kind of beauty that feels almost unreal when set against the landscape beneath it. Strange though it may now seem, Phillips in that era epitomised the anguished North London liberal, existentially unsure about whether to obey the dictates of her heart or her head. Quds News Network (QNN) is the largest independent and comprehensive Palestinian youth electronic news network."
363,ICC decision to investigate war crimes touches Israelis’ deepest fear (accountability),[],"Christmas is a story of empire, injustice and the vulnerability of ordinary people caught in its path. In Gaza, the sky often offers a kind of beauty that feels almost unreal when set against the landscape beneath it. Strange though it may now seem, Phillips in that era epitomised the anguished North London liberal, existentially unsure about whether to obey the dictates of her heart or her head. Quds News Network (QNN) is the largest independent and comprehensive Palestinian youth electronic news network."
364,I’m Jewish. I fight anti-Semitism and I support Palestinian rights,[],"Christmas is a story of empire, injustice and the vulnerability of ordinary people caught in its path. In Gaza, the sky often offers a kind of beauty that feels almost unreal when set against the landscape beneath it. Strange though it may now seem, Phillips in that era epitomised the anguished North London liberal, existentially unsure about whether to obey the dictates of her heart or her head. Quds News Network (QNN) is the largest independent and comprehensive Palestinian youth electronic news network."
365,Will the ICC actually hold Israel to account over war crimes?,[],"Christmas is a story of empire, injustice and the vulnerability of ordinary people caught in its path. In Gaza, the sky often offers a kind of beauty that feels almost unreal when set against the landscape beneath it. Strange though it may now seem, Phillips in that era epitomised the anguished North London liberal, existentially unsure about whether to obey the dictates of her heart or her head. Quds News Network (QNN) is the largest independent and comprehensive Palestinian youth electronic news network."
