,title,date,text
154,Effects of the Israeli blockade on the economic and humanitarian conditions in the Gaza Strip,"['September 13, 2021']","Christmas is a story of empire, injustice and the vulnerability of ordinary people caught in its path. In Gaza, the sky often offers a kind of beauty that feels almost unreal when set against the landscape beneath it. Strange though it may now seem, Phillips in that era epitomised the anguished North London liberal, existentially unsure about whether to obey the dictates of her heart or her head. Quds News Network (QNN) is the largest independent and comprehensive Palestinian youth electronic news network."
155,Palestine: An open-air museum of colonialism,"['September 8, 2021']","Christmas is a story of empire, injustice and the vulnerability of ordinary people caught in its path. In Gaza, the sky often offers a kind of beauty that feels almost unreal when set against the landscape beneath it. Strange though it may now seem, Phillips in that era epitomised the anguished North London liberal, existentially unsure about whether to obey the dictates of her heart or her head. Quds News Network (QNN) is the largest independent and comprehensive Palestinian youth electronic news network."
156,Nizar Banat’s death highlights brutality of Palestinian Authority,"['August 31, 2021']","Christmas is a story of empire, injustice and the vulnerability of ordinary people caught in its path. In Gaza, the sky often offers a kind of beauty that feels almost unreal when set against the landscape beneath it. Strange though it may now seem, Phillips in that era epitomised the anguished North London liberal, existentially unsure about whether to obey the dictates of her heart or her head. Quds News Network (QNN) is the largest independent and comprehensive Palestinian youth electronic news network."
157,We Can’t Fight the Climate Crisis Without Fighting the Military-Industrial Complex,"['August 13, 2021']","Christmas is a story of empire, injustice and the vulnerability of ordinary people caught in its path. In Gaza, the sky often offers a kind of beauty that feels almost unreal when set against the landscape beneath it. Strange though it may now seem, Phillips in that era epitomised the anguished North London liberal, existentially unsure about whether to obey the dictates of her heart or her head. Quds News Network (QNN) is the largest independent and comprehensive Palestinian youth electronic news network."
158,America Needs to Start Telling the Truth About Israel’s Nukes,"['August 11, 2021']","Christmas is a story of empire, injustice and the vulnerability of ordinary people caught in its path. In Gaza, the sky often offers a kind of beauty that feels almost unreal when set against the landscape beneath it. Strange though it may now seem, Phillips in that era epitomised the anguished North London liberal, existentially unsure about whether to obey the dictates of her heart or her head. Quds News Network (QNN) is the largest independent and comprehensive Palestinian youth electronic news network."
159,"Here in Jerusalem, we Palestinians are still fighting for our homes","['August 1, 2021']","Christmas is a story of empire, injustice and the vulnerability of ordinary people caught in its path. In Gaza, the sky often offers a kind of beauty that feels almost unreal when set against the landscape beneath it. Strange though it may now seem, Phillips in that era epitomised the anguished North London liberal, existentially unsure about whether to obey the dictates of her heart or her head. Quds News Network (QNN) is the largest independent and comprehensive Palestinian youth electronic news network."
160,Israel’s war on (‘anti-Semitic’) ice cream,"['July 31, 2021']","Christmas is a story of empire, injustice and the vulnerability of ordinary people caught in its path. In Gaza, the sky often offers a kind of beauty that feels almost unreal when set against the landscape beneath it. Strange though it may now seem, Phillips in that era epitomised the anguished North London liberal, existentially unsure about whether to obey the dictates of her heart or her head. Quds News Network (QNN) is the largest independent and comprehensive Palestinian youth electronic news network."
161,Israel And The US Desperate To Keep Palestinian Authority In Power,"['July 28, 2021']","Christmas is a story of empire, injustice and the vulnerability of ordinary people caught in its path. In Gaza, the sky often offers a kind of beauty that feels almost unreal when set against the landscape beneath it. Strange though it may now seem, Phillips in that era epitomised the anguished North London liberal, existentially unsure about whether to obey the dictates of her heart or her head. Quds News Network (QNN) is the largest independent and comprehensive Palestinian youth electronic news network."
162,How the international community created the current Palestinian crack on liberties,"['July 14, 2021']","Christmas is a story of empire, injustice and the vulnerability of ordinary people caught in its path. In Gaza, the sky often offers a kind of beauty that feels almost unreal when set against the landscape beneath it. Strange though it may now seem, Phillips in that era epitomised the anguished North London liberal, existentially unsure about whether to obey the dictates of her heart or her head. Quds News Network (QNN) is the largest independent and comprehensive Palestinian youth electronic news network."
163,"Imprisoned But Free: Letter from the heart from jailed Palestinian leader Khalida Jarrar to her daughter, Suha, gone too soon","['July 13, 2021']","Christmas is a story of empire, injustice and the vulnerability of ordinary people caught in its path. In Gaza, the sky often offers a kind of beauty that feels almost unreal when set against the landscape beneath it. Strange though it may now seem, Phillips in that era epitomised the anguished North London liberal, existentially unsure about whether to obey the dictates of her heart or her head. Quds News Network (QNN) is the largest independent and comprehensive Palestinian youth electronic news network."
164,Israel-Palestine: PA violence is part of Israel's colonial regime,"['July 11, 2021']","Christmas is a story of empire, injustice and the vulnerability of ordinary people caught in its path. In Gaza, the sky often offers a kind of beauty that feels almost unreal when set against the landscape beneath it. Strange though it may now seem, Phillips in that era epitomised the anguished North London liberal, existentially unsure about whether to obey the dictates of her heart or her head. Quds News Network (QNN) is the largest independent and comprehensive Palestinian youth electronic news network."
165,U.S. Support Is Keeping the Undemocratic Palestinian Authority Alive,"['July 3, 2021']","Christmas is a story of empire, injustice and the vulnerability of ordinary people caught in its path. In Gaza, the sky often offers a kind of beauty that feels almost unreal when set against the landscape beneath it. Strange though it may now seem, Phillips in that era epitomised the anguished North London liberal, existentially unsure about whether to obey the dictates of her heart or her head. Quds News Network (QNN) is the largest independent and comprehensive Palestinian youth electronic news network."
166,Israel-Palestine: How subcontracting the occupation fuels gendered violence,"['July 3, 2021']","Christmas is a story of empire, injustice and the vulnerability of ordinary people caught in its path. In Gaza, the sky often offers a kind of beauty that feels almost unreal when set against the landscape beneath it. Strange though it may now seem, Phillips in that era epitomised the anguished North London liberal, existentially unsure about whether to obey the dictates of her heart or her head. Quds News Network (QNN) is the largest independent and comprehensive Palestinian youth electronic news network."
167,The Palestinian Authority Is A Subcontractor For Israel’s Occupation,"['June 30, 2021']","Christmas is a story of empire, injustice and the vulnerability of ordinary people caught in its path. In Gaza, the sky often offers a kind of beauty that feels almost unreal when set against the landscape beneath it. Strange though it may now seem, Phillips in that era epitomised the anguished North London liberal, existentially unsure about whether to obey the dictates of her heart or her head. Quds News Network (QNN) is the largest independent and comprehensive Palestinian youth electronic news network."
168,Nizar Banat killing: Why the PA's days are numbered,"['June 28, 2021']","Christmas is a story of empire, injustice and the vulnerability of ordinary people caught in its path. In Gaza, the sky often offers a kind of beauty that feels almost unreal when set against the landscape beneath it. Strange though it may now seem, Phillips in that era epitomised the anguished North London liberal, existentially unsure about whether to obey the dictates of her heart or her head. Quds News Network (QNN) is the largest independent and comprehensive Palestinian youth electronic news network."
169,Nizar Banat killing: The world must stop enabling PA crimes,"['June 25, 2021']","Christmas is a story of empire, injustice and the vulnerability of ordinary people caught in its path. In Gaza, the sky often offers a kind of beauty that feels almost unreal when set against the landscape beneath it. Strange though it may now seem, Phillips in that era epitomised the anguished North London liberal, existentially unsure about whether to obey the dictates of her heart or her head. Quds News Network (QNN) is the largest independent and comprehensive Palestinian youth electronic news network."
170,Gaza: Will my son take his first breath during war?,"['June 23, 2021']","Christmas is a story of empire, injustice and the vulnerability of ordinary people caught in its path. In Gaza, the sky often offers a kind of beauty that feels almost unreal when set against the landscape beneath it. Strange though it may now seem, Phillips in that era epitomised the anguished North London liberal, existentially unsure about whether to obey the dictates of her heart or her head. Quds News Network (QNN) is the largest independent and comprehensive Palestinian youth electronic news network."
171,Apartheid by stealth,"['June 20, 2021']","Christmas is a story of empire, injustice and the vulnerability of ordinary people caught in its path. In Gaza, the sky often offers a kind of beauty that feels almost unreal when set against the landscape beneath it. Strange though it may now seem, Phillips in that era epitomised the anguished North London liberal, existentially unsure about whether to obey the dictates of her heart or her head. Quds News Network (QNN) is the largest independent and comprehensive Palestinian youth electronic news network."
172,Israel-Palestine: Offering 'concern' solves nothing. It's time for a new approach,"['June 20, 2021']","Christmas is a story of empire, injustice and the vulnerability of ordinary people caught in its path. In Gaza, the sky often offers a kind of beauty that feels almost unreal when set against the landscape beneath it. Strange though it may now seem, Phillips in that era epitomised the anguished North London liberal, existentially unsure about whether to obey the dictates of her heart or her head. Quds News Network (QNN) is the largest independent and comprehensive Palestinian youth electronic news network."
173,"On 'conflict', 'peace' and 'genocide': Time for new language on Palestine and Israel","['June 14, 2021']","Christmas is a story of empire, injustice and the vulnerability of ordinary people caught in its path. In Gaza, the sky often offers a kind of beauty that feels almost unreal when set against the landscape beneath it. Strange though it may now seem, Phillips in that era epitomised the anguished North London liberal, existentially unsure about whether to obey the dictates of her heart or her head. Quds News Network (QNN) is the largest independent and comprehensive Palestinian youth electronic news network."
174,Israel-Palestine: The natural order of occupation is coming to an end,"['June 10, 2021']","Christmas is a story of empire, injustice and the vulnerability of ordinary people caught in its path. In Gaza, the sky often offers a kind of beauty that feels almost unreal when set against the landscape beneath it. Strange though it may now seem, Phillips in that era epitomised the anguished North London liberal, existentially unsure about whether to obey the dictates of her heart or her head. Quds News Network (QNN) is the largest independent and comprehensive Palestinian youth electronic news network."
175,Israel-Palestine: There are not 'two narratives' - just one deadly reality,"['June 9, 2021']","Christmas is a story of empire, injustice and the vulnerability of ordinary people caught in its path. In Gaza, the sky often offers a kind of beauty that feels almost unreal when set against the landscape beneath it. Strange though it may now seem, Phillips in that era epitomised the anguished North London liberal, existentially unsure about whether to obey the dictates of her heart or her head. Quds News Network (QNN) is the largest independent and comprehensive Palestinian youth electronic news network."
176,Absolving empire in Palestine,"['June 6, 2021']","Christmas is a story of empire, injustice and the vulnerability of ordinary people caught in its path. In Gaza, the sky often offers a kind of beauty that feels almost unreal when set against the landscape beneath it. Strange though it may now seem, Phillips in that era epitomised the anguished North London liberal, existentially unsure about whether to obey the dictates of her heart or her head. Quds News Network (QNN) is the largest independent and comprehensive Palestinian youth electronic news network."
177,A new mental health crisis is raging in Gaza,"['June 5, 2021']","Christmas is a story of empire, injustice and the vulnerability of ordinary people caught in its path. In Gaza, the sky often offers a kind of beauty that feels almost unreal when set against the landscape beneath it. Strange though it may now seem, Phillips in that era epitomised the anguished North London liberal, existentially unsure about whether to obey the dictates of her heart or her head. Quds News Network (QNN) is the largest independent and comprehensive Palestinian youth electronic news network."
178,"Israel looks to change from a right-wing government to another, perhaps even more, right-wing government","['June 4, 2021']","Christmas is a story of empire, injustice and the vulnerability of ordinary people caught in its path. In Gaza, the sky often offers a kind of beauty that feels almost unreal when set against the landscape beneath it. Strange though it may now seem, Phillips in that era epitomised the anguished North London liberal, existentially unsure about whether to obey the dictates of her heart or her head. Quds News Network (QNN) is the largest independent and comprehensive Palestinian youth electronic news network."
179,"Biden, Palestine, and the buttressing of Christian Zionism","['May 29, 2021']","Christmas is a story of empire, injustice and the vulnerability of ordinary people caught in its path. In Gaza, the sky often offers a kind of beauty that feels almost unreal when set against the landscape beneath it. Strange though it may now seem, Phillips in that era epitomised the anguished North London liberal, existentially unsure about whether to obey the dictates of her heart or her head. Quds News Network (QNN) is the largest independent and comprehensive Palestinian youth electronic news network."
180,How Israel uses disinformation to delegitimise the Palestinian cause,"['May 26, 2021']","Christmas is a story of empire, injustice and the vulnerability of ordinary people caught in its path. In Gaza, the sky often offers a kind of beauty that feels almost unreal when set against the landscape beneath it. Strange though it may now seem, Phillips in that era epitomised the anguished North London liberal, existentially unsure about whether to obey the dictates of her heart or her head. Quds News Network (QNN) is the largest independent and comprehensive Palestinian youth electronic news network."
181,How India makes Kashmiris pay for Palestine solidarity,"['May 25, 2021']","Christmas is a story of empire, injustice and the vulnerability of ordinary people caught in its path. In Gaza, the sky often offers a kind of beauty that feels almost unreal when set against the landscape beneath it. Strange though it may now seem, Phillips in that era epitomised the anguished North London liberal, existentially unsure about whether to obey the dictates of her heart or her head. Quds News Network (QNN) is the largest independent and comprehensive Palestinian youth electronic news network."
182,What Trevor Noah gets wrong about Palestine,"['May 24, 2021']","Christmas is a story of empire, injustice and the vulnerability of ordinary people caught in its path. In Gaza, the sky often offers a kind of beauty that feels almost unreal when set against the landscape beneath it. Strange though it may now seem, Phillips in that era epitomised the anguished North London liberal, existentially unsure about whether to obey the dictates of her heart or her head. Quds News Network (QNN) is the largest independent and comprehensive Palestinian youth electronic news network."
183,Jerusalem is ready to explode - the world can't say it wasn't warned,"['May 1, 2021']","Christmas is a story of empire, injustice and the vulnerability of ordinary people caught in its path. In Gaza, the sky often offers a kind of beauty that feels almost unreal when set against the landscape beneath it. Strange though it may now seem, Phillips in that era epitomised the anguished North London liberal, existentially unsure about whether to obey the dictates of her heart or her head. Quds News Network (QNN) is the largest independent and comprehensive Palestinian youth electronic news network."
184,The battle for Jerusalem's Damascus Gate offers a rare beacon of hope,"['May 1, 2021']","Christmas is a story of empire, injustice and the vulnerability of ordinary people caught in its path. In Gaza, the sky often offers a kind of beauty that feels almost unreal when set against the landscape beneath it. Strange though it may now seem, Phillips in that era epitomised the anguished North London liberal, existentially unsure about whether to obey the dictates of her heart or her head. Quds News Network (QNN) is the largest independent and comprehensive Palestinian youth electronic news network."
185,Halting Palestine’s Democratic Decline,"['April 27, 2021']","Christmas is a story of empire, injustice and the vulnerability of ordinary people caught in its path. In Gaza, the sky often offers a kind of beauty that feels almost unreal when set against the landscape beneath it. Strange though it may now seem, Phillips in that era epitomised the anguished North London liberal, existentially unsure about whether to obey the dictates of her heart or her head. Quds News Network (QNN) is the largest independent and comprehensive Palestinian youth electronic news network."
186,Israeli Racist Attacks On Jerusalem Spark Ramadan Intifada,"['April 24, 2021']","Christmas is a story of empire, injustice and the vulnerability of ordinary people caught in its path. In Gaza, the sky often offers a kind of beauty that feels almost unreal when set against the landscape beneath it. Strange though it may now seem, Phillips in that era epitomised the anguished North London liberal, existentially unsure about whether to obey the dictates of her heart or her head. Quds News Network (QNN) is the largest independent and comprehensive Palestinian youth electronic news network."
187,Ahead of Easter and Eid Al-Fitr: Palestinians' long fasting for freedom goes On,"['April 20, 2021']","Christmas is a story of empire, injustice and the vulnerability of ordinary people caught in its path. In Gaza, the sky often offers a kind of beauty that feels almost unreal when set against the landscape beneath it. Strange though it may now seem, Phillips in that era epitomised the anguished North London liberal, existentially unsure about whether to obey the dictates of her heart or her head. Quds News Network (QNN) is the largest independent and comprehensive Palestinian youth electronic news network."
188,"As Israel rejects the ICC investigation, what are the possible scenarios?","['April 14, 2021']","Christmas is a story of empire, injustice and the vulnerability of ordinary people caught in its path. In Gaza, the sky often offers a kind of beauty that feels almost unreal when set against the landscape beneath it. Strange though it may now seem, Phillips in that era epitomised the anguished North London liberal, existentially unsure about whether to obey the dictates of her heart or her head. Quds News Network (QNN) is the largest independent and comprehensive Palestinian youth electronic news network."
189,Murdering minorities in America: ‘The white man’s burden’,"['April 11, 2021']","Christmas is a story of empire, injustice and the vulnerability of ordinary people caught in its path. In Gaza, the sky often offers a kind of beauty that feels almost unreal when set against the landscape beneath it. Strange though it may now seem, Phillips in that era epitomised the anguished North London liberal, existentially unsure about whether to obey the dictates of her heart or her head. Quds News Network (QNN) is the largest independent and comprehensive Palestinian youth electronic news network."
190,The US media is touting Israel's Covid recovery. But occupied Palestinians are left out,"['April 10, 2021']","Christmas is a story of empire, injustice and the vulnerability of ordinary people caught in its path. In Gaza, the sky often offers a kind of beauty that feels almost unreal when set against the landscape beneath it. Strange though it may now seem, Phillips in that era epitomised the anguished North London liberal, existentially unsure about whether to obey the dictates of her heart or her head. Quds News Network (QNN) is the largest independent and comprehensive Palestinian youth electronic news network."
191,Jagmeet Singh’s cowardice on Palestine sparks Canadian backlash,"['April 10, 2021']","Christmas is a story of empire, injustice and the vulnerability of ordinary people caught in its path. In Gaza, the sky often offers a kind of beauty that feels almost unreal when set against the landscape beneath it. Strange though it may now seem, Phillips in that era epitomised the anguished North London liberal, existentially unsure about whether to obey the dictates of her heart or her head. Quds News Network (QNN) is the largest independent and comprehensive Palestinian youth electronic news network."
192,How Israeli rights groups prevent Palestinians from framing their own reality,"['April 5, 2021']","Christmas is a story of empire, injustice and the vulnerability of ordinary people caught in its path. In Gaza, the sky often offers a kind of beauty that feels almost unreal when set against the landscape beneath it. Strange though it may now seem, Phillips in that era epitomised the anguished North London liberal, existentially unsure about whether to obey the dictates of her heart or her head. Quds News Network (QNN) is the largest independent and comprehensive Palestinian youth electronic news network."
193,The EU needs to face its institutional racism problem,"['March 29, 2021']","Christmas is a story of empire, injustice and the vulnerability of ordinary people caught in its path. In Gaza, the sky often offers a kind of beauty that feels almost unreal when set against the landscape beneath it. Strange though it may now seem, Phillips in that era epitomised the anguished North London liberal, existentially unsure about whether to obey the dictates of her heart or her head. Quds News Network (QNN) is the largest independent and comprehensive Palestinian youth electronic news network."
194,Why I Signed the Jerusalem Declaration on Antisemitism,"['March 29, 2021']","Christmas is a story of empire, injustice and the vulnerability of ordinary people caught in its path. In Gaza, the sky often offers a kind of beauty that feels almost unreal when set against the landscape beneath it. Strange though it may now seem, Phillips in that era epitomised the anguished North London liberal, existentially unsure about whether to obey the dictates of her heart or her head. Quds News Network (QNN) is the largest independent and comprehensive Palestinian youth electronic news network."
195,How Palestine is a critical feminist issue,"['March 26, 2021']","Christmas is a story of empire, injustice and the vulnerability of ordinary people caught in its path. In Gaza, the sky often offers a kind of beauty that feels almost unreal when set against the landscape beneath it. Strange though it may now seem, Phillips in that era epitomised the anguished North London liberal, existentially unsure about whether to obey the dictates of her heart or her head. Quds News Network (QNN) is the largest independent and comprehensive Palestinian youth electronic news network."
