,title,text
53,Russia: Is this is a war with the Khazarian Mafia running the US?,"The Khazarian Mafia will destroy Europe to bolster their worldwide criminal empire DISCLOSURE: Sourced from Iranian government funded media Russia says the United States’ hands in the conflict in Ukraine are “visible,” rejecting a portrayal of foreign interference in the war as discreet. China’s Foreign Minister Qin Gang had earlier said that the Ukraine crisis seemed to be driven by an “invisible hand” pushing for the protraction and escalation of the conflict. That “invisible hand” is “using the Ukraine crisis to serve certain geopolitical agendas,” Qin said at a press conference on the sidelines of a parliamentary meeting in Beijing. He also warned that the conflict may escalate or “spiral out of control,” calling for dialog to begin as soon as possible. Russian President Vladimir Putin’s spokesman, Dmitry Peskov, however, said on Tuesday that he had “to disagree with our Chinese comrades.” “This is of course a joke. You know what the joke is: this is not an invisible hand, this is the hand of the United States of America, this is the hand of Washington,” Peskov said. “Washington does not want this war to end. Washington wants, and is doing everything to, continue this war. This is the visible hand,” Peskov added. The Kremlin has said the sanctions and the Western military assistance will only prolong the war. While China is politically aligned with Russia, it has called for an end to the war. Last week, China put forward a 12-point document for peace talks between Kiev and Moscow to end the war. It urged respect for national sovereignty and condemned the usage of “unilateral sanctions,” in a criticism of the Western sanctions again Russia. Referring to the peace initiative, Peskov said, “A big, giant, powerful, and authoritative country like China can’t fail to have its own voice on those problems that stand high on the world agenda. We pay great attention to all the ideas we hear from our colleagues in Beijing.” Western leaders, however, have largely dismissed the peace plan. The West has also threatened China with unspecified “consequences” if it provides weapons to Russia. Original Source:  Press TV Iran Jonas E. Alexis has degrees in mathematics and philosophy. He studied education at the graduate level. His main interests include U.S. foreign policy, the history of the Israel/Palestine conflict, and the history of ideas. He is the author of the book, Kevin MacDonald’s Metaphysical Failure: A Philosophical, Historical, and Moral Critique of Evolutionary Psychology, Sociobiology, and Identity Politics. He teaches mathematics and logic in South Korea. Latest Posts >>>
Jonas’ Archives (2016-2022) >>>
Jonas’ Archives (2004-2015) >>> In the darkness the Dragon slinks away
knowing that he must find cover
For in the coming morning light
once trusting eyes will find him
Then Karma arrives and she is a bitch This is likely the best journalist at VT…
Yes this is true… and to not recognize it… will cost the loss of the American Republic. God has entrusted the renewal of both the Church and the world, including peace, to the Blessed Virgin Mary, Queen of Heaven and Earth: “Continue to pray the Rosary every day in honor of Our Lady of the Rosary, in order to obtain peace for the world and the end of the war, because only She can help you.” (Our Lady of Fatima, July 13, 1917) “Tell everybody that God gives graces through the Immaculate Heart of Mary. Tell them to ask graces from Her and that the Heart of Jesus wishes to be venerated together with the Immaculate Heart of Mary. Ask them to plead for peace from the Immaculate Heart of Mary, for the Lord has confided the peace of the world to Her.” (Jacinto Marto, Fatima seer, 1919, to her cousin Lucia soon before dying at age nine) See “The Entire Story of the Apparitions of Our Lady of Fatima and the Angel” on YouTube. O00000000ooooooo WOE on the markets… One thing is certain, the U.S. and its NATO Gnomes have fallen dangerously, if not decades, behind in peer power capabilities in weapons and delivery systems.  Hypersonic missiles are a total game changer.  They could take out every European NATO capitol city before any response could be sent.  Their unstoppable hypersonics put us back in the 50s, “put your head under your desk and cover your ass” days.  Yet the insane Neocons seem to want to foment a war with them, even if it kills nhalfb off us here on earth to, at this point regain their “Full Spectrum Dominance” for which they risk ALL LIFE ON EARTH. Can anyone out there think of anything more power crazy as Seymour Hersh outs their destruction of Nordstream as an ACT OF WAR against a top  peer nuclear weapons adversary.  Is Biden insane just lost in dementia or a clever commander.  Its your ass and those of your family that he is risking in his reckless pursuit of absolute control…!!!! notice the vents behind the ear..  there R a couple of these w his no hunting son from ireland..  jumpin out of his skin binden may B a 200th..  no vein in his forhead – valve. thm irans R going to recruit a PMC 2 fite the pranksters in is-not-real/kazars.. in sept & the republicrats o to bankrupt ol jumpin joe (who) when the debt celing has 2 B raised..  the possible last lender of resorts is the corps who will buy T bills when they issue corp bonds.. since thre is no clear end poing in these TG postings.  You cannot calculate a second order derivative – offset against the stastical average..  ??  will the ruskies dump w the chicoms = raling the curve 4 a steady state – 3rd order >? ** https://t.me/infodefENGLAND/5938 ** https://t.me/DDGeopolitics/55307 The Khazarian’s JANET YELLEN is the one in the USGOV who is responsible for the escalation of the war against Russia. It’s very possible that she chose Biden and not the other way around. Being that she’s the Khazarian/Rothschild banking family’s agent in the USGOV it’s her that’s running the show in Washington not Biden. YELLEN, in collusion with the Khazarian/Rothschild banking family, chose Biden and his entire administration to carry out their quest of establishing their New World Order. Thankfully Vladimir Putin is aware of USGOV’s seeking a unipolar world and has other countries, including China, that’s seeking to establish a multipolar world instead of the Khazarian/Rothschild family’s unipolar world. UN w Nato (whitehouse) – its been rumored that joe is a 200 and the gaffs are a stage skit/sho..  go bak and look at the number of times he slipped of of the boeing..  he should hav broke his hip @X mabey 3X when he hit the step; but he managed hold the rail in a senior fall ???  HMMM? yeller is a mouthpiee and powell is chigago school..  thre is about 20T$ in the equities market / actually private “Script simplar to local bank currency in the 1800’s until the Fed Inception Yellen announced before she became Treasury Secretary that once in office SHE was going to SANCTION RUSSIA because of Russia’s “illegal annexation of Crimea” back in 2014. Once Biden was sworn in as President in 2014 one of the first things he did was to start SANCTIONING RUSSIA. She called it and he followed up on her orders. He’s her puppet.
How do I get a notice that a reply to a comment of mine has been made? logically there is no way to carry this as a trade long/short the red hav about 75M unces of gold..  around 550B$ in reserves; lets skip the T-Bills – they R sitting under vlads bed N a shoe box.. 150B$ in Ag/equiv v/s a kazarian dinero’s of 550B$..  its a pretty good bet the reds R going to smak the shOt’ on teh global curriencies..  the chinese hav around 3T$ in reserves (Ria Novosti today)..  our Fed has around 85B$ on hand – nothing to lend v/s printing and mega inflationary spirals… now somebody tosses a match on the puddle of gas or some volatile (Dioxane is good) ad nostrum..  and that 25% ~~ 13/55×100 = zeezUS ! i wonder what that 25% ratio in a binomial expansion will look like if the muskovites add say another 10 to 25Million ounces of gold w the stasch under the bed… the – hehe” need 4 greed` ~ is met @ hong kong king~.. the russians admit they still hold 400B$ T-Bills…  screamin yellen would have to cancel entire series of issues thru previous windows…  what i don’t no”’ i think the kazars, are going to get barbeRkued as pritzie(Wag PMC) contienues {his ho chi minn rain’ danc’e w the }sacred weather machine”…  ! as a part time trader..  do I buy ABX or more Yuan (CHF)  ??  ABX @ 22-25 and wait for a Ag melt down 0ver 2300$..  barney rubels will hit 60 and the mao’s will hit over 75..  bi monial expansion..  1st order derivative..  i.e. freezinf poind depression.. At the rate at which the khazarian mafia is continuing to dominate in the great satan, it has vanquished the wasps, very soon Washingtons K Street will be renamed Kagan Street. Xi brought 60 tons of gold around jan..  vlad snatched somethig like 50..  about 120 tons hav been shipped out for freight on deck – delivery… i am looking for some numbers of gold sitting in the wharehouses of london.. ?  i think the NYC wharehouse has closed..  something about tungsten plated in gold – like just about everything on the floor being leased… The great satan has gone berserk, China is now printing is US dollars!! Shanghai banks open accounts with upto $2b credit in their books. The clearing for these dollar balances is done at Beijing, no need to pass through international clearing at NY Federal Reserve, trade being done with correspondents holding similar genuine fake dollars. At any time the balances may be converted to yuan at the prevailing international exchange rate. Perfect, satans unlimited piggy bank duplicated!! No wonder it wants to start a war on China. clearing for these dollar balances is done at Beijing… actually its the hangseng..  hongkongking..  its futures/bonds HKG ::  Hong Kong and Mainland Chinese issuers; mai currency is HKD$ HKD::  Contract Specification the chicoms trade thru the hang seng CHY.. the dollars are not fake er say ! –> think of it as a big blob of mercury in a petri dish – swishing w/o spilling and amalgamating everything in the room.. vlad & xi are not talking about tanks and 155’s..  they are bringing in their top finny people..  thats who globe trotting fro chin and muskovite; their ministers in time.. sit bak..  they newbies R slo on the go..  but they are buying gold tonnage and taking physical delivery..  this is a very lengthy process..  everything here has to be assayed and validated by the new kaars who are getting seats at the round-about table.. the zappo 4 no more crappo’s is the smasing of reserves outside of the east..  they will not had 2 red cents for a new arms program..  thats what bankoed the russians in the late 80’s…  leahmans 400 ship navy and massive mil spending by regan; the reds are not goinig for an on-coreo-graphing… converting to yuans – differiantal; the chicoms  want a strong yoan yet..  they hav ALWAYS ben’ beheaded in the forex; the chicoms will work against their currency for stable swift settlements.. xi and vlad are moving to a bitcoing type settlement sistem.  just about time the police dept start laying off cops – hos[itals – school lunches – firefiters / letting prisons reduce populations…  of when it really comes sloshing home here..  this happened bak in carter when the bill -4- vietman  (deficite spending- Nixon) came due…… Comments are closed."
54,“Kiev Hid Its Dead Soldiers in the Ravines”. Ukrainian POW Unveils Zelensky Crimes in an Exclusive Video,"“If you refuse to go into battle, they can shoot you” by Gospa News editorial staff ITALIAN VERSION «My name is Vitaly Saidov and I was born on October 27, 1988, 81st Brigade, 90th Battalion, 2nd Company, 2nd Platoon, 1st Squad. I was captured on January 13, 2023 in Belogorovka». Thus begins the exclusive video (link at the bottom of this article) that was sent to us by an Italian freelancer (who oversaw the translation in English too) with contacts in Donbass on the testimony of a Ukrainian prisoner captured by Russian troops together with four other comrades who surrendered. One of our consultants, expert in Slavic languages, confirmed the fidelity of the translation from the Ukrainian and the details of the story make it extremely credible even if, obviously, we cannot swear on the reliability of the contents and its identity. In it he reveals the chaotic state of the Ukrainian Army despite the proclamations of President Volodymyr Zslensky who, according to Saidov, ordered the deserters to be shot on the spot.  But it also tells of inadequate training, the lack of reinforcements at the front and the possibility of avoiding combat zones by paying bribes to officers. He also explains that the superiors have the order to bury the fallen in the clashes in mass graves so as not to declare their death to relatives in order to avoid paying the due state compensation.  The state of abandonment of the Kiev troops is also confirmed by the fact that not only are adult Ukrainian males recruited through the use of the police, even if previously exempt from military service due to congenital pathologies, but families are forced to pay the more expensive than equipment such as infrared night vision goggles. This was told to us by a direct source in contact with the parent of a fighter who also explained a speculation on the prices of the materials, sold at a higher than usual price. NATO Leopard for the Ukraine War Escalation. “Only very Experts can Manage its Power”. Analysis by former Italian Tank Commander  This openly clashes with the propaganda of NATO countries such as Italy on the necessary sending of military aid to Ukraine and leads us to believe that behind these shipments, segregated on the number of armaments supplied, the black market of international arms trafficking could flourish, denounced by some months as a concrete danger from the director of Interpol. Saidov was captured by the Akhmat and Bars units. The soldiers of the Chechen special forces “Akhmat” are under the command of General Apti Alaudino and their regiment is named after Achmat Abdulchamidovič Kadyrov, hero of the first Chechen War of Independence then appointed by Vladimir Putin as head of the new provisional administration before being proclaimed president of the Autonomous Republic of Chechnya. He was killed in a 9 May 2004 terrorist bomb attack that destroyed the VIP section of the Sultan Bilimchanov Stadium in Grozny, inside which a parade was taking place to celebrate Victory Day. “Western Weapons could end up in Criminals Hands”. Interpol issues Ukrainian Warning  The Akhmat regiment fights on the Northern front of Donbass together with the soldiers of the 6th NM LPR Regiment who deal with the Southern front and was fundamental for the conquest of the strategic city of Soledar by the Russians. It operated jointly with the BARS (National Combat Forces Reserve) unit, a military reserve force of the Russian Federation deployed as of 2021 and used in the special operation of de-militarization and de-nazification of Ukraine launched on 24 February 2022 following the umpteenth barrage of bombings by the Kiev army against the ethnic Russian populations of the separatist republics of Donetzk and Lugansk in violation of the Minsk Accords. Russian Documents Uphold Preparation by Kiev of Offensive Operation in Donbass before the Invasion  After having narrated the military context, the losses suffered, the absence of the commanders in the field, from the 5th minute onwards of the video he makes the most sensational revelations.  “The information on our Brigade’s FB and Instagram about minimal successes and losses is a lie because we are suffering heavy losses which are replenished by new arrivals,” says Private Saidov.  “This is how high losses are masked. The dead are stacked at dumping points in ravines and are not taken out for identification. They are later reported as missing for not paying compensation to their families.” This very serious statement leads us to believe that the mass graves denounced by the Kiev authorities as evidence of Russian war crimes could instead be the places of concealment of their own fallen… Kiev’s Forces Shelled a Detention Center in Donbass because “the Nazi began to Testify on War Crimes”. 53 Azov POWs Killed  Such cruelty is not surprising. Last July, the news of the bombings made by Ukrainian artillery on one of the Russian prisons where the paramilitary Azov Battalion captured by the Moscow army in Mariupol had caused dismay. A massacre ordered by Zelensky to silence the witnesses of war crimes committed in the Donbass over the years who were revealing the details as then also done by an American neo-Nazi who had fought with this group. «We have been notified of a presidential order: if a soldier refuses to participate in military operations he is considered a deserter and is simply shot by his comrades. The company commander told us directly by radio. He said it was an order from the battalion commander.’ Zelensky Nightmare by 25 thousand Ukraine Troops! Army Discipline Crackdown Sparks Fury on the Front  The reference is to the new law approved by Zelensky in December to toughen the punishments against his soldiers which has given rise to the petition of 25,000 soldiers of all ranks who hang over the regime in Kiev with the specter of a revolt. Finally Saidov concludes by saying that only a fraction of the soldiers of the companies he knows have been trained in Great Britain but have already been killed or seriously injured. Because «they haven’t learned anything in particular» since it is necessary to know English otherwise it makes no sense». Gospa News Editorial Staff
© COPYRIGHT GOSPA NEWS
prohibition of reproduction without authorization 
follow Gospa News on Telegram MAIN SOURCES GOSPA NEWS – WEAPONS LOBBY DOSSIER GOSPA NEWS – UKRAINE DOSSIER  An American Neo-Nazi who Fought within Azov Battalion Avowes the Crimes of his Ukrainian ‘colleagues’  EU Parliament Member Rebukes Zelensky for a War without Truce   Fabio is investigative journalist since 1991. Now geopolitics, intelligence, military, SARS-Cov-2 manmade, NWO expert and Director-founder of Gospa News: a Christian Information Journal. His articles were published on many international media and website as SouthFront, Reseau International, Sputnik Italia, United Nation Association Westminster, Global Research, Kolozeg and more… Most popolar investigation on VT is: Rumsfeld Shady Heritage in Pandemic: GILEAD’s Intrigues with WHO & Wuhan Lab. Bio-Weapons’ Tests with CIA & Pentagon Fabio Giuseppe Carlo Carisio, born on 24/2/1967 in Borgosesia, started working as a reporter when he was only 19 years old in the alpine area of Valsesia, Piedmont, his birth region in Italy. After studying literature and history at the Catholic University of the Sacred Heart in Milan, he became director of the local newspaper Notizia Oggi Vercelli and specialized in judicial reporting. For about 15 years he is a correspondent from Northern Italy for the Italian newspapers Libero and Il Giornale, also writing important revelations on the Ustica massacre, a report on Freemasonry and organized crime. With independent investigations, he collaborates with Carabinieri and Guardia di Finanza in important investigations that conclude with the arrest of Camorra entrepreneurs or corrupt politicians. In July 2018 he found the counter-information web media Gospa News focused on geopolitics, terrorism, Middle East, and military intelligence. In 2020 published the book, in Italian only, WUHAN-GATES – The New World Order Plot on SARS-Cov-2 manmade focused on the cycle of investigations Wuhan-Gates His investigations was quoted also by The Gateway Pundit, Tasnim and others He worked for many years for the magazine Art & Wine as an art critic and curator. VETERANS TODAY OLD POSTS Propaganda, in order to create disinformation, bends all the cliches that “history” (or Propaganda itself) makes available to it. Exclusive means that all other information is fallacious.
If you do not know Italy you will not even understand the meaning of cliché and exclusive.
The UKR ravines are like the Italian “FOIBE” of 1945.
Poor you all. If there is any justice in Ukraine, elements of the Army will catch up with the maggot Zelensky and his Cabal of murderous swindlers and deal with bastards. Quick boys! Do it now, before they escape to America or their bolt hole in Israel. I was expecting some kind of reaction from the officers soon those crimes have started but one can see that they rather see the entire army be wrecked that risking their own life for their man´s. I can add that the army and other “state” bodies in Ukraine are not a state, but a private company that pays taxes, which can be seen on the corresponding website.  As such, there has been no conscription army since 2007, and all who serve in it are contract soldiers.  Since the organization is private, they don’t want to pay the dead.  Many employees are there without any documents, and in case of injury or illness, they are treated at their own expense.  Also on the Telegram network, they post videos from Odessa in which “military commissars” forcefully grab men on the street and take them away. to…Andrew Armavir (Russia)
in reference to your Ohio question…
Its marked as a false flag by many sources…
Read http://mileswmathis.com/coronad.pdf
True or false…no idea but ((imo)) heebie-crap. Dear Sir, Fabio G. C. Carisio, tell people here about American chemical Chernobyl in Ohio please. There are hundreds of such interviews. I watch it almost every day. And, yes, these videos have no eng lang subtitles… Unfortunately. I´m in the E.U and i have heard and readed about the chemical explosion but i can assure you: as a vassal as we are, one can´t find anithing related to anythng that put´s exceptional´s in a bad photograf, let alone some explosion that put´s millions of those exceptionaly one´s in danger Comments are closed."
