,title,text
0,Foad Debate TV from Tehran: My You Tube Interview with Mark Dankof (46:20),"Foad Debate: In my recent conversation with Mark Dankof, a senior political analyst and former member of the Republican Party, we delved into a series of seemingly isolated yet highly suspicious incidents across the globe. From the attack on a Jewish gathering in Sydney to the assassination of an MIT professor in the U.S., a nuclear physicist and supporter of the Israeli regime, and the killing of Charlie Kirk, Dankof argues with compelling evidence, that these are pieces of a larger, deliberately orchestrated puzzle. Their purpose? To fuel ethnic and religious tensions in the West and legitimize the Zionist regime’s next strategic moves.
  
During the interview, Dankof pulled back the curtain on the dark history of Israeli state terrorism from the bombing of the King David Hotel and the Deir Yassin massacre in the past, to the assassination of Iranian nuclear scientists and support for Takfiri groups in the region. By analyzing Netanyahu’s recent threatening statements urging the West to “take him seriously,” and revealing documents suggesting possible Mossad links to some of these events, Dankof warns that we are on the brink of a hidden, full-scale global conflict. The ultimate goal: to divert public attention from the catastrophe in Gaza and drag America into another war in the Middle East. Mark Dankof is the former 36th District Chairman of the Republican Party in King County/Seattle. He was an elected delegate to Texas State Republican Conventions in 1994 and 1996 and entered the United States Senate race in Delaware in 2000 as the nominated candidate of the Constitution Party against Democratic candidate Thomas Carper and Republican incumbent William Roth. Mark is the host of The Dankof Report for the Republic Broadcasting Network and is occasionally seen abroad on Press TV, the Tasnim News Agency, IRINN, Geopolitika, Katehon, and Sputnik. His lectures for Texas homeschoolers on subjects like Dispensationalism and Christian Zionism, the American Empire, I John, Jonah, and  Lutheran theology are accessible online. Mark’s interview with the Fars News Agency on 9-11 and his presentation on Pearl Harbor and False Flag Methodology for the American Free Press National Conference of 2013 in Austin, Texas are considered two of the American Alt Right’s most significant contributions of the last 25 years. Log in to leave a comment"
1,The HUGE TRUMP’s HOAX on EPSTEIN Files,"Only a Partial release that “grossly fails to comply with both the spirit and the letter of the law” Table of Contents by Carlo Domenico Cristofori The Federal Bureau of Investigation (FBI) has started to publish materials from the case of Jeffrey Epstein, who was convicted of corrupting minors and later committed suicide. Epstein was arrested by New York State law enforcement in July 2019. The prosecutor’s office reported that between 2002 and 2005 he arranged visits to his Manhattan home for dozens of underage girls, the youngest being 14. Documents related to the investigation into Jeffrey Epstein were released today on the Justice Department’s website. They include never-before-released photographs of former President Bill Clinton with Epstein and a 1996 description of a criminal complaint against the late convicted sex offender. The collection, described as “enormous,” includes nearly 100,000 pages of paper documents, over 300 GB of digital data from computers, CDs, and storage devices, and recently declassified grand jury materials. Some content may be partially redacted to protect victims or for national security reasons, but the law prohibits delays related to political reasons or embarrassment. EPSTEIN-TRUMP-GATE (2 Videos). US Zionist RING amid PEDOPHILIA and POLITICS: Terrible Quaking after new Email. Congressman: “Power Gang Must End.” MAGA Rift “In the Name of Jesus”  CNN pointed out: Of the files provided, entire pages were redacted and the department withheld more from the documents than required by law. The DOJ also failed to release all the documents, as was called for in the bipartisan legislation passed last month. Rep. Thomas Massie, the Republican lawmaker who led the effort to force a vote on the legislation, said the partial release “grossly fails to comply with both the spirit and the letter of the law.” Some survivors also expressed frustration as they struggled to find information about their own cases.  The documents appears, at least after early reviews, to include no smoking guns and relatively few major revelations. Update – TRUMP SIGNS Bll to Release EPSTEIN Dossier. But Pedophile’s Brother accuses: “Files SANITIZED to protect Trump” (video)  As Mark Epstein, brother of Jeffrey, anticipated by stating that many documents had been “sanitized” precisely to protect the Republicans and President Donald Trump, a close friend of the suicidal pedophile, as evidenced by many photos that have long been released by the media.  Here are some takeaways. More suspicion: After months of the administration stepping on its own toes and making it look like it had something to hide, it did itself few favors with its rollout. For one, the Justice Department didn’t release all the documents, as was required by the deadline today, 30 days after Congress passed its law. And secondly, the documents carried extensive redactions — and for more reasons than the law prescribed. The redactions were also inconsistent, with the same content being redacted in one instance but not in another. https://rumble.com/v71xxl4-very-sad-video-by-epstein-survivors-psa.html A heavy dose of Clinton: The documents, while only partial, featured a heavy dose of former President Bill Clinton. And the administration took great care to point that out. There were a number of never-before-released pictures of Clinton. But perhaps the most notable ones showed Clinton in water next to someone whose face was redacted. Clinton spokesman Angel Ureña the administration’s focus on the former president amounted to “shielding themselves from what comes next, or from what they’ll try and hide forever.” Lack of Trump: It’s really remarkable how little the president’s name and appearance show up in this first batch of documents, at least after early reviews. It was especially notable how many pictures of Clinton there were in the first batch of documents, compared to how few there were of Trump. This despite Trump and Epstein having had what clearly appears to be a close friendship for many years, as the New York Times recapped this week.  Law enforcement warned: Aside from the politics here, this is really about the failure to bring Epstein to justice earlier. Epstein in the late 2000s cut a much-derided sweetheart deal before he was ultimately charged again in 2019, shortly before his suicide. And one entry in the new documents confirms just how long the system failed. More famous people: Powerful men keep getting wrapped up in these document dumps. This new dump, for instance, includes photos of Michael Jackson. In one photo, Jackson appears with Clinton and Diana Ross. (Jackson died in 2009. Ross and Jackson’s estate did not immediately comment to CNN.) In other photos dated from 2007, Epstein is pictured across a table from the late newsman Walter Cronkite. BREAKING NEWS Meanwhile Ghislaine Maxwell, Jeffrey Epstein’s accomplice, has asked a federal court to overturn or modify her 20-year prison sentence for sex trafficking, claiming that “new evidence has emerged demonstrating that the trial was unfair.” “New Jeffrey Epstein Autopsy Photo proves he didn’t Kill Himself” his Brother said. Warning: Chilling Photo  Maxwell filed a writ of habeas corpus (i.e., asking a judge to review the legality of her detention by physically bringing her back to court) arguing that information that would have led to her exoneration at the 2021 trial “was withheld and that false testimony was presented to the jury. The cumulative effect of these constitutional violations constitutes a complete miscarriage of justice, rendering the appellant’s conviction invalid, unfounded, and unlawful.” Carlo Domenico Cristofori  EPSTEIN DEATH, THE GAMBINO’S ZIONIST MOBSTER REVELATIONS    Fabio is investigative journalist since 1991. Now geopolitics, intelligence, military, SARS-Cov-2 manmade, NWO expert and Director-founder of Gospa News: a Christian Information Journal. His articles were published on many international media and website as SouthFront, Reseau International, Sputnik Italia, United Nation Association Westminster, Global Research, Kolozeg and more… Most popolar investigation on VT is: Rumsfeld Shady Heritage in Pandemic: GILEAD’s Intrigues with WHO & Wuhan Lab. Bio-Weapons’ Tests with CIA & Pentagon Fabio Giuseppe Carlo Carisio, born on 24/2/1967 in Borgosesia, started working as a reporter when he was only 19 years old in the alpine area of Valsesia, Piedmont, his birth region in Italy. After studying literature and history at the Catholic University of the Sacred Heart in Milan, he became director of the local newspaper Notizia Oggi Vercelli and specialized in judicial reporting. For about 15 years he is a correspondent from Northern Italy for the Italian newspapers Libero and Il Giornale, also writing important revelations on the Ustica massacre, a report on Freemasonry and organized crime. With independent investigations, he collaborates with Carabinieri and Guardia di Finanza in important investigations that conclude with the arrest of Camorra entrepreneurs or corrupt politicians. In July 2018 he found the counter-information web media Gospa News focused on geopolitics, terrorism, Middle East, and military intelligence. In 2020 published the book, in Italian only, WUHAN-GATES – The New World Order Plot on SARS-Cov-2 manmade focused on the cycle of investigations Wuhan-Gates His investigations was quoted also by The Gateway Pundit, Tasnim and others He worked for many years for the magazine Art & Wine as an art critic and curator. VETERANS TODAY OLD POSTS Log in to leave a comment"
2,‘Oreshnik’ deployed to deter NATO aggression in Eastern Europe,"Back in April 2024, the Russian Strategic Missile Forces (RVSN) test-fired what was then described as a “mysterious ICBM” (intercontinental ballistic missile) from the Kapustin Yar range in the Astrakhan region (oblast) in Southern Russia. The missile hit the Sary Shagan testing ground in Kazakhstan, located approximately 1,600 km to the east. At the time, the RVSN didn’t reveal the exact type of missile it launched, while the Russian Ministry of Defense (MoD) only said that the launch was conducted to test a “prospective missile system”. The launch left many observers puzzled, with some claiming that it was an existing system (specifically the RS-26 “Rubezh”). However, several analysts (myself included) argued that it may also be a new weapon designed to outmatch any contemporary (or even prospective) offensive missile system. Today we know that was the first time Russia tested its latest strategic “toy” – the “Oreshnik. This truly groundbreaking weapon represents the very pinnacle of Russian engineering, as it can use a plethora of payloads, including MaRV (maneuverable reentry vehicle), MIRV (multiple independently targetable reentry vehicle), HGV (hypersonic glide vehicle), etc. In terms of the functioning of its warhead, the available footage shows that the “Oreshnik” can carry at least 36 smaller projectiles divided into six blocks (with six kinetic submunitions in each). During its first combat use in November 2024, the “Oreshnik” demonstrated why it has the reputation of being effectively invincible. Although the area was protected by overhyped and exorbitantly overpriced US-made “Patriots”, there were no launches from the ground as the “Oreshnik” struck like a meteorite. Since then, there haven’t been a lot of reports on this new system, with only occasional updates on its status or the mainstream propaganda machine’s smear campaigns mixed in with whining that Europe is defenseless against it. On December 17, President Vladimir Putin finally broke the silence and announced that the “Oreshnik” will officially be placed on combat duty by the end of 2025. This was the first major update from the Russian side, following the announcement that the missile system was already in mass production. Namely, in late June, President Putin confirmed this during a speech to graduates of law enforcement and military academies at the Kremlin. While pointing out the fact that NATO is escalating its aggression against the entire world by pushing for a new arms race, he stated that the Russian military is also getting new weapon systems. Putin first mentioned the RS-24 “Yars”, an advanced ICBM with maneuvering warheads. This wasn’t accidental, as this weapon is essentially part of the wider family of solid-fuel missiles, along with the previously mentioned RS-26 “Rubezh” and the “Oreshnik”. In other words, it’s highly likely they share production lines, just like the 9M723 of the 9K720M “Iskander-M” and the 9-S-7760 of the 9-A-7660 “Kinzhal” systems. This isn’t a mere cost-saving measure, but also a matter of logistics, ease of production, maintenance, etc. This is the legacy Russia inherited from Soviet times, when it had by far the world’s most advanced arsenal of SRBMs, MRBMs and IRBMs (short-range, medium-range and intermediate-range ballistic missiles). All this changed after the INF (Intermediate-Range Nuclear Forces) Treaty was signed in 1987. We’re not going to go into too much detail regarding all of this, but we should definitely mention one specific missile that was the crown jewel of Soviet rocketry – the RSD-10 “Pioneer” (NATO reporting name SS-20 “Saber”). It was a solid-fueled ballistic missile with a range of up to 5,800 km and the only IRBM in history capable of using three MIRV warheads. These had a yield of 150 kt each or roughly 10 (30 altogether) times more powerful than the Hiroshima bomb. There was also a version with a single 1 Mt warhead that was around 67 times more destructive. At least 728 such missiles were made and you can imagine they would’ve turned any target into a radioactive glass desert for the next several eons. Obviously, Russia had a massive advantage, but this would’ve hardly mattered given that both sides would’ve simply destroyed each other. Thus, the aforementioned INF Treaty was enforced, prompting both sides to dismantle and destroy all of their ground-based medium and intermediate-range missiles. However, on August 2, 2019, the US unilaterally withdrew its signature, just like it did with all other crucial arms control treaties over the last 20-25 years. Only two years later, in 2021, meaning before the SMO (special military operation), the US Army reactivated the 56th Artillery Command in Wiesbaden (district Mainz-Kastel), Germany. Precisely this unit is now equipped with the previously banned medium and intermediate-range missiles, with plans to induct new platforms, such as the “Dark Eagle”, officially known as the Long-Range Hypersonic Weapon (LRHW). However, the Pentagon is struggling to develop even basic hypersonic weapon systems. Namely, the “Dark Eagle” is already five years behind schedule, much unlike Russian hypersonic missiles, which are decades ahead, both in terms of quality and quantity. This includes upgrades to existing platforms, such as the now legendary “Iskander”, as well as new weapons, such as the “Oreshnik”. Even worse (for NATO), President Aleksandr Lukashenko publicly announced that the missile system is now also deployed in Belarus, where it will serve to deter NATO’s potential plans to invade the country. And indeed, the “Oreshnik’s” advanced maneuvering warheads can approach targets from unexpected directions. Combined with their sheer speed and penetration capabilities, this effectively nullifies the political West’s ability to defend its potential “Barbarossa 2.0” invasion force from preemptive long-range precision strikes. As a Senior Editor at the now-defunct Fort Russ News, I wrote daily about military technology, global economy and geopolitics, with a special focus on the Middle East, Balkans, Russia, China, United States, Europe and great power rivalry. In 2020, Fort Russ News was hit by a major cyber-attack, so the website has been liquidated, but my articles (nearly 1,500 of them are still available on the Web Archives). I’m also active on social networks (particularly Facebook and Telegram), where I’m an administrator of various pages and groups dealing with the aforementioned topics. One such page that was recently deleted (thanks Zuck!) had over 150,000 followers, but we’ve seen since moved to Telegram, so we’re slowly working toward rebuilding that following (Telegram). Many other media have republished my work, the most prominent of which are (Global Research), Southfront,Anti-Empire , and respected Serbian publications such as Politika. For the last two years, I’ve been a daily contributor to the BRICS Information Portal. Log in to leave a comment"
3,"Mark Dankof on RBN Live: Friday, December 19th, 2025","Friday, December 19th, 2025: Mark Dankof on RBN Live at 1 pm Central Time: Topic: Andrew Torba’s “An Occupied Nation: The Menorah on the Lawn”.  The news summary covers DAWN launching the “Faces of AIPAC,” Brown/MIT murders linked, JDL Recruitment Resumption: Zio-Terror in America?, Venezuela, Russia-Ukraine, Gaza, Israel, Iran, the Epstein Files, the Swiss Policy Research: JFK Assassination 1963 Videos: 30 of Them, and Mark Weber’s warning to America. Show Roadmap Here.     Friday, December 19th, 2025: Mark Dankof on RBN Live at 1 pm Central Time: Topic: Andrew Torba’s “An Occupied Nation: The Menorah on the Lawn”.  The news summary covers DAWN launching the “Faces of AIPAC,” Brown/MIT murders linked, JDL Recruitment Resumption: Zio-Terror in America?, Venezuela, Russia-Ukraine, Gaza, Israel, Iran, the Epstein Files, the Swiss Policy Research: JFK Assassination 1963 Videos: 30 of Them. , and Mark Weber’s warning to America. RBN Broadcast: Here Mark Dankof is the former 36th District Chairman of the Republican Party in King County/Seattle. He was an elected delegate to Texas State Republican Conventions in 1994 and 1996 and entered the United States Senate race in Delaware in 2000 as the nominated candidate of the Constitution Party against Democratic candidate Thomas Carper and Republican incumbent William Roth. Mark is the host of The Dankof Report for the Republic Broadcasting Network and is occasionally seen abroad on Press TV, the Tasnim News Agency, IRINN, Geopolitika, Katehon, and Sputnik. His lectures for Texas homeschoolers on subjects like Dispensationalism and Christian Zionism, the American Empire, I John, Jonah, and  Lutheran theology are accessible online. Mark’s interview with the Fars News Agency on 9-11 and his presentation on Pearl Harbor and False Flag Methodology for the American Free Press National Conference of 2013 in Austin, Texas are considered two of the American Alt Right’s most significant contributions of the last 25 years. Log in to leave a comment"
